{
	"$schema": "https://json-schema.org/draft/2020-12/schema",
	"$id": "https://cassandragargoyle.org/schemas/graph-view.schema.json",
	"$version": "1.1.0",
	"title": "GraphView",
	"description": "Language-independent contract for the 3D force-directed node-graph viewer (graphlens). A domain-agnostic document of meta + nodes + links, consumed by the ptx-graphlens plugin (portunix-plugins #086) and the GraphLens3D React component (portunix-vscode #050). Files using this format use the '.glens.json' filename suffix. Distinct from the 2D Graph Canvas format (GraphFile: nodes + edges + metadata, '*.graph.json', portunix-vscode #030); this 3D format uses 'links' (not 'edges') and 'meta' (not 'metadata').",
	"type": "object",
	"required": ["nodes", "links"],
	"properties": {
		"version": {
			"type": "string",
			"description": "Optional document format version (semver), independent of the schema $version"
		},
		"meta": {
			"type": "object",
			"description": "Viewer metadata; 'title' and 'groups' are the known keys, other keys are allowed",
			"properties": {
				"title": {
					"type": "string",
					"description": "Graph title shown by the viewer"
				},
				"groups": {
					"type": "object",
					"description": "Optional map of group key (see node.group) to group definition. Readers use their default styling for a group key without a definition",
					"additionalProperties": {
						"type": "object",
						"properties": {
							"label": {
								"type": "string",
								"description": "Legend and filter label. When missing, the key is shown"
							},
							"color": {
								"type": "string",
								"description": "Color as #RRGGBB. When missing, readers use their default color",
								"pattern": "^#[0-9a-fA-F]{6}$",
								"maxLength": 7
							}
						},
						"additionalProperties": false
					}
				}
			},
			"additionalProperties": true
		},
		"nodes": {
			"type": "array",
			"description": "Node list",
			"items": {
				"type": "object",
				"required": ["id", "type", "label"],
				"properties": {
					"id": {
						"type": "string",
						"description": "Unique node id, referenced by link.source and link.target"
					},
					"type": {
						"type": "string",
						"description": "Node kind (e.g. 'tag', 'voice'); drives styling"
					},
					"label": {
						"type": "string",
						"description": "Display label"
					},
					"group": {
						"type": "string",
						"description": "Optional group key, usually defined in meta.groups. When missing, readers use their default grouping",
						"minLength": 1
					},
					"voice": {
						"type": "string",
						"description": "Voice category for voice nodes"
					},
					"title": {
						"type": "string",
						"description": "Detail-panel title"
					},
					"description": {
						"type": "string",
						"description": "Detail-panel body"
					},
					"meta": {
						"type": "object",
						"description": "Free-form extra metadata for the detail panel",
						"additionalProperties": true
					}
				},
				"additionalProperties": false
			}
		},
		"links": {
			"type": "array",
			"description": "Edge list referencing node ids",
			"items": {
				"type": "object",
				"required": ["source", "target"],
				"properties": {
					"source": {
						"type": "string",
						"description": "Source node id (must match a node.id)"
					},
					"target": {
						"type": "string",
						"description": "Target node id (must match a node.id)"
					},
					"description": {
						"type": "string",
						"description": "Optional edge description"
					},
					"rel": {
						"type": "string",
						"description": "Relationship category for styling (e.g. 'related')"
					}
				},
				"additionalProperties": false
			}
		}
	},
	"additionalProperties": false
}
